{
  "version": "2",
  "lenguaje": "typescript",
  "framework_pruebas": "vitest",
  "objetivo": "calcularDescuento",
  "intento": 1,
  "archivo": "precios.test.ts",
  "codigo": "import { describe, expect, it } from 'vitest';\nimport { calcularDescuento } from '../src/tienda/precios';\n\ndescribe('calcularDescuento', () => {\n  it('descuento_normal', () => {\n    expect(calcularDescuento(100, 20)).toBe(80);\n  });\n\n  it('porcentaje_invalido', () => {\n    expect(() => calcularDescuento(100, 150)).toThrow(RangeError);\n  });\n});\n",
  "casos_cubiertos": ["descuento_normal", "porcentaje_invalido"]
}
